{
  "source_mode": "block",
  "items": [
    {
      "department": "智能矿山事业部",
      "work_section": "项目推进",
      "delivery_group": "新疆交付组",
      "project": "红沙泉二矿项目",
      "item_type": "PROJECT_TASK",
      "assignee": [],
      "title": "数据中心施工进展",
      "content": "数据中心吊顶安装完成90%，空调设备已到货。",
      "evidence": {
        "text": "数据中心吊顶安装完成90%，空调设备已到货。",
        "page_start": null,
        "page_end": null,
        "start_char": 0,
        "end_char": 23,
        "exact_match": true
      }
    }
  ],
  "project_entities": [
    {
      "entity_id": "P-HSQ2",
      "canonical_name": "红沙泉二矿项目",
      "aliases": ["红沙泉二矿项目"],
      "source_names": ["红沙泉二矿项目"],
      "decisions": []
    }
  ],
  "merge_trace": [
    {
      "item_index": 0,
      "source_indexes": [0],
      "merged": false,
      "evidence_mode": "single",
      "evidence_contiguous": true,
      "source_evidence": [
        {
          "text": "数据中心吊顶安装完成90%，空调设备已到货。",
          "page_start": null,
          "page_end": null,
          "start_char": 0,
          "end_char": 23,
          "exact_match": true
        }
      ],
      "project_entity_id": "P-HSQ2",
      "title_source": "source",
      "notes": []
    }
  ],
  "validation": {
    "status": "PASS",
    "issues": [],
    "issue_counts": {}
  }
}
